{
  "business_name": "a Thai Noodle Bar",
  "validation_status": "requires_review",
  "field_completeness_score": 1,
  "missing_fields": [],
  "signal_conflicts": [
    "has_blog_or_updates is false but notes state a blog or update section is present with structured content."
  ],
  "edge_cases_detected": [
    "reviews_count is 102 and reviews_rating is 4.6, providing a strong and statistically reliable trust signal."
  ],
  "recommended_action": "Resolve conflict on has_blog_or_updates before proceeding: verify whether a blog or updates section exists on the site and correct the structured signal accordingly.",
  "normalised_input": {
    "business_name": "a Thai Noodle Bar",
    "website": "https://athai.ie/",
    "location": "Westport, Co. Mayo, Ireland",
    "industry": "Hospitality And Restaurant",
    "source": "Google Maps",
    "signals": {
      "ssl_active": true,
      "platform": "WordPress",
      "pagespeed_mobile": 97,
      "pagespeed_desktop": 99,
      "mobile_ux": "good",
      "has_contact_form": true,
      "has_booking_system": true,
      "has_blog_or_updates": false,
      "reviews_rating": 4.6,
      "reviews_count": 102
    },
    "notes": "Multi page structure with clear navigation and defined service sections. Strong visual hierarchy, readable typography, and consistent branding. Clear call to action placement and mobile layout appears well optimised. Blog or update section present with structured content."
  }
}