{
  "business_name": "Petals Hair & Beauty Westport",
  "validation_status": "requires_review",
  "field_completeness_score": 1,
  "missing_fields": [],
  "signal_conflicts": [
    "pagespeed_desktop is 25 while pagespeed_mobile is 52, meaning desktop scores lower than mobile, which is atypical and may indicate a data entry error or measurement anomaly.",
    "has_contact_form is true but notes state the contact form is difficult to find, which may indicate a functional discrepancy between presence and usability that could affect downstream scoring."
  ],
  "edge_cases_detected": [
    "pagespeed_mobile (52) and pagespeed_desktop (25) differ by 27 points, which is a notable disparity, but more critically desktop is lower than mobile — an unusual reversal worth flagging.",
    "Notes mention broken elements on the website, suggesting the site may have rendering or functional issues that could affect audit reliability.",
    "reviews_rating of 4.8 with a review count of 312 represents a strong and well-supported trust signal."
  ],
  "recommended_action": "Resolve the pagespeed_desktop value (25) before proceeding — desktop scoring lower than mobile is anomalous and likely reflects a data error that would skew performance recommendations.",
  "normalised_input": {
    "business_name": "Petals Hair & Beauty Westport",
    "website": "https://petals.ie/",
    "location": "Westport, Co. Mayo, Ireland",
    "industry": "Hairdresser",
    "source": "Local knowledge/ google maps",
    "signals": {
      "ssl_active": true,
      "platform": "Phorest",
      "pagespeed_mobile": 52,
      "pagespeed_desktop": 25,
      "mobile_ux": "ok",
      "has_contact_form": true,
      "has_booking_system": true,
      "has_blog_or_updates": false,
      "reviews_rating": 4.8,
      "reviews_count": 312
    },
    "notes": "Layout is cluttered. The navbar is all over the place it can be refined. Conatct form is difficult to find. The website is made using phorest. There are broken elements and they could benefit from a blog. The website is confusing and difficultto navigate"
  }
}